{
	"fields": {
		"type": "text",
		"data": "file"
	},
	"defaultPage": null,
	"content": "$END<h5 style=\"margin: 0; padding: 0; color: gray; font-weight: normal;\">{{pagens}}:{{pagename}}</h5>\n<h1 style=\"margin-top: 0;\">{{pagename}}</h1>\n<img src=\"data:image/{{field type png}};base64,{{field64 data }}\">",
	"files": {
		"image": {"type": "image/{{field type png}}", "content": "{{field data }}"}
	}
}